{
  "schemaVersion": 1,
  "id": "hk_modern_13f_v1",
  "version": "1.0.0",
  "displayName": "Hong Kong Modern 13-Faan Teaching Profile v1",
  "description": "A fully materialized alternate profile that demonstrates common higher-value and 13-faan variations.",
  "disclaimer": "This alternate teaching profile demonstrates table variation; it is not more official than the default profile.",
  "standardComparisonRulesetId": null,
  "scoringEvaluatorVersion": "hk-scoring-v1",
  "patternSemantics": {
    "version": "hk_nyc_limits_v1",
    "fourConcealedPungs": { "winMode": "self_draw_only", "concealedKongsCount": false },
    "nineGates": { "waitMode": "pure_nine_sided", "declaredKongsAllowed": false },
    "thirteenOrphans": { "requireThirteenSidedWait": false },
    "coloredDragons": { "requireAllPungsOrKongs": true, "requireMatchingSuitPair": true },
    "heavenlyHand": { "initialBonusReplacementsAllowed": true, "kongBeforeWinAllowed": false },
    "earthlyHand": {
      "trigger": "dealer_first_discard",
      "initialBonusReplacementsAllowed": true,
      "kongBeforeWinAllowed": false
    },
    "limitAggregation": "cap_once_list_all_matches",
    "suppressNonLimitRulesWhenLimitMatches": true
  },
  "tileSet": {
    "bonusTilesEnabled": true,
    "replacementDrawDirection": "back",
    "ordinaryDrawDirection": "front",
    "exhaustionBoundary": "draw_ends_meet"
  },
  "bonusRules": {
    "seatMapping": [
      { "seat": "east", "flower": "flower.plum", "season": "season.spring" },
      { "seat": "south", "flower": "flower.orchid", "season": "season.summer" },
      { "seat": "west", "flower": "flower.chrysanthemum", "season": "season.autumn" },
      { "seat": "north", "flower": "flower.bamboo", "season": "season.winter" }
    ]
  },
  "winRules": {
    "minimumFaan": 3,
    "capFaan": 13,
    "multipleWinners": false,
    "sameTileWinLockUntilNextDraw": false,
    "passedWinLockTriggers": "explicit_pass",
    "passedWinLockIncludesKongRobbery": true,
    "allowSevenPairs": true,
    "sevenPairsAllowsQuadAsTwoPairs": false,
    "specialHandsStackWithSuitPatterns": true,
    "allowThirteenOrphans": true,
    "allowNineGates": true,
    "initialDealWinsEnabled": true
  },
  "claimRules": {
    "equalPriorityResolution": "nearest_after_discarder",
    "multipleWinnerPayment": "settle_each_winner"
  },
  "kongRules": {
    "robAddedKong": true,
    "robConcealedKong": false,
    "concealedKongRobberyForms": [],
    "allowKongImmediatelyAfterChowOrPung": false
  },
  "roundRules": {
    "prevailingWinds": ["east", "south", "west", "north"],
    "dealerRepeatsOnWin": true,
    "dealerRepeatsOnDraw": true,
    "dealerRepeatsWhenAmongMultipleWinners": true
  },
  "scoringRules": [
    {
      "id": "no_bonus_tiles",
      "names": { "en": "No Flowers or Seasons", "zhHant": "無花", "zhHans": "无花" },
      "evaluator": "no_bonus_tiles",
      "value": { "type": "faan", "amount": 1 },
      "enabled": true,
      "category": "bonus",
      "stackingGroup": "bonus_presence",
      "implies": [],
      "suppresses": [],
      "excludes": [{ "target": "stacking_group", "id": "owned_bonus" }],
      "explanation": "The winner has no exposed Flower or Season while bonus tiles are enabled.",
      "examples": ["Win without collecting any of F1–F4 or S1–S4."],
      "houseRuleSensitive": true
    },
    {
      "id": "seat_flower",
      "names": { "en": "Seat Flower", "zhHant": "正花", "zhHans": "正花" },
      "evaluator": "seat_flower",
      "value": { "type": "faan", "amount": 1 },
      "enabled": true,
      "category": "bonus",
      "stackingGroup": "owned_bonus",
      "implies": [],
      "suppresses": [],
      "excludes": [{ "target": "rule", "id": "no_bonus_tiles" }],
      "explanation": "The winner owns the Flower mapped to their seat.",
      "examples": ["East owns Plum (F1)."],
      "houseRuleSensitive": true
    },
    {
      "id": "seat_season",
      "names": { "en": "Seat Season", "zhHant": "正季", "zhHans": "正季" },
      "evaluator": "seat_season",
      "value": { "type": "faan", "amount": 1 },
      "enabled": true,
      "category": "bonus",
      "stackingGroup": "owned_bonus",
      "implies": [],
      "suppresses": [],
      "excludes": [{ "target": "rule", "id": "no_bonus_tiles" }],
      "explanation": "The winner owns the Season mapped to their seat.",
      "examples": ["South owns Summer (S2)."],
      "houseRuleSensitive": true
    },
    {
      "id": "all_chows",
      "names": { "en": "All Chows / Ping Wu", "zhHant": "平和", "zhHans": "平和" },
      "evaluator": "all_chows",
      "value": { "type": "faan", "amount": 1 },
      "enabled": true,
      "category": "hand_composition",
      "stackingGroup": "primary_standard_shape",
      "implies": [],
      "suppresses": [],
      "excludes": [{ "target": "rule", "id": "all_pungs" }],
      "explanation": "Four chows and a non-scoring suited pair, with no pung or kong.",
      "examples": ["123m 456m 234p 678s with a 55p pair."],
      "houseRuleSensitive": true
    },
    {
      "id": "concealed_hand",
      "names": { "en": "Concealed Hand", "zhHant": "門前清", "zhHans": "门前清" },
      "evaluator": "concealed_hand",
      "value": { "type": "faan", "amount": 1 },
      "enabled": true,
      "category": "hand_composition",
      "stackingGroup": null,
      "implies": [],
      "suppresses": [],
      "excludes": [],
      "explanation": "No chow, pung, or exposed kong was claimed from another player's discard.",
      "examples": ["A closed hand won by self-draw or a final discard."],
      "houseRuleSensitive": true
    },
    {
      "id": "dragon_pung",
      "names": { "en": "Dragon Pung or Kong", "zhHant": "三元牌", "zhHans": "三元牌" },
      "evaluator": "dragon_pung",
      "value": { "type": "faan", "amount": 1 },
      "enabled": true,
      "category": "wind_dragon",
      "stackingGroup": null,
      "implies": [],
      "suppresses": [],
      "excludes": [],
      "explanation": "One faan for each distinct Red, Green, or White Dragon pung or kong.",
      "examples": ["A pung of Red Dragons adds one faan."],
      "houseRuleSensitive": false
    },
    {
      "id": "seat_wind",
      "names": { "en": "Seat Wind Pung or Kong", "zhHant": "門風", "zhHans": "门风" },
      "evaluator": "seat_wind",
      "value": { "type": "faan", "amount": 1 },
      "enabled": true,
      "category": "wind_dragon",
      "stackingGroup": null,
      "implies": [],
      "suppresses": [],
      "excludes": [],
      "explanation": "A pung or kong of the winner's seat wind.",
      "examples": ["South wins while holding a South Wind pung."],
      "houseRuleSensitive": false
    },
    {
      "id": "prevailing_wind",
      "names": { "en": "Prevailing Wind Pung or Kong", "zhHant": "圈風", "zhHans": "圈风" },
      "evaluator": "prevailing_wind",
      "value": { "type": "faan", "amount": 1 },
      "enabled": true,
      "category": "wind_dragon",
      "stackingGroup": null,
      "implies": [],
      "suppresses": [],
      "excludes": [],
      "explanation": "A pung or kong of the prevailing wind; it may also be the seat wind.",
      "examples": ["An East pung in the East round adds one faan."],
      "houseRuleSensitive": false
    },
    {
      "id": "self_draw",
      "names": { "en": "Self-Drawn Win", "zhHant": "自摸", "zhHans": "自摸" },
      "evaluator": "self_draw",
      "value": { "type": "faan", "amount": 1 },
      "enabled": true,
      "category": "winning_condition",
      "stackingGroup": "win_source",
      "implies": [],
      "suppresses": [],
      "excludes": [],
      "explanation": "The winning tile was drawn from the live wall or replacement end.",
      "examples": ["Draw the tile that completes the hand."],
      "houseRuleSensitive": false
    },
    {
      "id": "last_tile_draw",
      "names": { "en": "Last Tile Draw", "zhHant": "海底撈月", "zhHans": "海底捞月" },
      "evaluator": "last_tile_draw",
      "value": { "type": "faan", "amount": 1 },
      "enabled": true,
      "category": "winning_condition",
      "stackingGroup": null,
      "implies": [{ "target": "rule", "id": "self_draw" }],
      "suppresses": [],
      "excludes": [{ "target": "rule", "id": "last_tile_discard" }],
      "explanation": "A self-draw win on the final ordinary live-wall tile.",
      "examples": ["The last live draw completes the hand."],
      "houseRuleSensitive": true
    },
    {
      "id": "last_tile_discard",
      "names": { "en": "Last Tile Discard", "zhHant": "河底撈魚", "zhHans": "河底捞鱼" },
      "evaluator": "last_tile_discard",
      "value": { "type": "faan", "amount": 1 },
      "enabled": true,
      "category": "winning_condition",
      "stackingGroup": "win_source",
      "implies": [],
      "suppresses": [],
      "excludes": [
        { "target": "rule", "id": "last_tile_draw" },
        { "target": "rule", "id": "self_draw" }
      ],
      "explanation": "A win on the discard made after the final ordinary live-wall draw.",
      "examples": ["Claim the final discard after the live wall is exhausted."],
      "houseRuleSensitive": true
    },
    {
      "id": "robbing_kong",
      "names": { "en": "Robbing the Kong", "zhHant": "搶槓", "zhHans": "抢杠" },
      "evaluator": "robbing_kong",
      "value": { "type": "faan", "amount": 1 },
      "enabled": true,
      "category": "winning_condition",
      "stackingGroup": "win_source",
      "implies": [],
      "suppresses": [],
      "excludes": [{ "target": "rule", "id": "self_draw" }],
      "explanation": "The winning tile was being added to another player's exposed pung.",
      "examples": ["Win on the fourth tile before an added kong resolves."],
      "houseRuleSensitive": true
    },
    {
      "id": "replacement_win",
      "names": { "en": "Win on Replacement Tile", "zhHant": "槓上開花", "zhHans": "杠上开花" },
      "evaluator": "replacement_win",
      "value": { "type": "faan", "amount": 1 },
      "enabled": true,
      "category": "winning_condition",
      "stackingGroup": null,